{
  "meta": {
    "dataVersion": "1.0.1",
    "lastUpdated": "2026-07-20T21:08:07.000Z",
    "unemploymentPeriod": "May 2026",
    "eeocPeriod": "FY2024",
    "notes": "Compliance data current as of mid-2026. Verify with linked official sources before relying on any figure for a compliance decision.",
    "reviewNotes": [
      "Minimum wage rate changes (22 states + DC) are payroll-critical \u2014 confirm against the linked state source and route to your compliance owner before payroll use.",
      "PFML contribution-rate changes (CA, NJ, NY, WA, CO, DC, MN) affect withholding \u2014 verify before updating payroll systems.",
      "AZ, CO, AK, VT, and NM figures were corroborated via secondary official-domain sources because the state site blocked direct fetch \u2014 spot-check these before relying on them.",
      "Maryland PFML is delayed to 2028 (not mid-2026) \u2014 confirm before communicating internally.",
      "Unemployment table reflects BLS May 2026 LAUS; re-verify when the June 2026 release posts."
    ]
  },
  "minimumWage": {
    "AL": [
      7.25,
      "No state law \u2014 federal minimum applies",
      "Federal",
      "https://www.dol.gov/agencies/whd/minimum-wage/state"
    ],
    "AK": [
      14.0,
      "Ballot Measure 1 step increase; $15 effective Jul 2027; CPI indexing resumes 2028",
      "Jul 2026",
      "https://labor.alaska.gov/lss/whhome.htm"
    ],
    "AZ": [
      15.15,
      "Indexed to CPI; Flagstaff: $18.35 (tip credit eliminated Jan 2026)",
      "Jan 2026",
      "https://www.azica.gov/labor-minimum-wage-main-page"
    ],
    "AR": [
      11,
      "",
      "Jan 2021",
      "https://labor.arkansas.gov/labor/labor-standards/minimum-wage-and-overtime/"
    ],
    "CA": [
      16.9,
      "$20 for fast food workers; some locality rates higher",
      "Jan 2026",
      "https://www.dir.ca.gov/dlse/faq_minimumwage.htm"
    ],
    "CO": [
      15.16,
      "Indexed to CPI annually; Denver: $19.29",
      "Jan 2026",
      "https://cdle.colorado.gov/wages/minimum-wage-information"
    ],
    "CT": [
      16.94,
      "Increases tied to CPI through 2026",
      "Jan 2026",
      "https://portal.ct.gov/dol/divisions/wage-and-workplace-standards/standard-wage-rates"
    ],
    "DE": [
      15,
      "",
      "Jan 2025",
      "https://industrialaffairs.delaware.gov/wage-hour"
    ],
    "FL": [
      14,
      "Increases to $15 Sep 30, 2026; then CPI",
      "Sep 2025",
      "https://floridajobs.org/florida-minimum-wage"
    ],
    "GA": [
      5.15,
      "State below federal \u2014 FLSA $7.25 applies",
      "",
      "https://dol.georgia.gov/minimum-wage"
    ],
    "HI": [
      16,
      "Increases to $18 by Jan 2028",
      "Jan 2026",
      "https://labor.hawaii.gov/wsd/minimum-wage/"
    ],
    "ID": [
      7.25,
      "No state law above federal",
      "Federal",
      "https://www.labor.idaho.gov/businesses/labor-laws/labor-laws-faq/"
    ],
    "IL": [
      15,
      "Chicago: $17.05 (eff. Jul 1, 2026); Cook County: $15.40 (tipped $9.25)",
      "Jan 2025",
      "https://labor.illinois.gov/laws-rules/fls/minimum-wage-law.html"
    ],
    "IN": [
      7.25,
      "No state law above federal",
      "Federal",
      "https://www.in.gov/dol/wage-and-hour/wage-and-hour-home/"
    ],
    "IA": [
      7.25,
      "No state law above federal",
      "Federal",
      "https://dial.iowa.gov/hearings/wage-and-child-labor/wages"
    ],
    "KS": [
      7.25,
      "No state law above federal",
      "Federal",
      "https://www.dol.ks.gov/employers/workplace-laws"
    ],
    "KY": [
      7.25,
      "No state law above federal",
      "Federal",
      "https://elc.ky.gov/workplace-standards/Pages/Wages-and-Hours.aspx"
    ],
    "LA": [
      7.25,
      "No state law \u2014 federal applies",
      "Federal",
      "https://www.dol.gov/agencies/whd/minimum-wage/state"
    ],
    "ME": [
      15.1,
      "Indexed to CPI; agricultural workers now covered (2025 law)",
      "Jan 2026",
      "https://www.maine.gov/labor/docs/2026/posters/minwage/English_minimum_wage.pdf"
    ],
    "MD": [
      15,
      "Montgomery Co: tiered $15.95-$18.00 (eff Jul 2026); Prince George's Co: $15.30 (eff Jan 2026)",
      "Jan 2024",
      "https://www.labor.maryland.gov/labor/wages/wagehrfacts.shtml"
    ],
    "MA": [
      15,
      "",
      "Jan 2023",
      "https://www.mass.gov/info-details/massachusetts-law-about-minimum-wage"
    ],
    "MI": [
      13.73,
      "Increasing to $15.00 by Jan 2027 per SB 8 (post-Mothering Justice ruling); tipped 40% of standard rate",
      "Jan 2026",
      "https://www.michigan.gov/leo/bureaus-agencies/ber/wage-and-hour/min-wage"
    ],
    "MN": [
      11.41,
      "Single statewide rate as of 2026 (large/small employer tiers eliminated); training wage $9.31 (under-20, first 90 days)",
      "Jan 2026",
      "https://www.dli.mn.gov/business/employment-practices/minimum-wage-minnesota"
    ],
    "MS": [
      7.25,
      "No state law \u2014 federal applies",
      "Federal",
      "https://www.dol.gov/agencies/whd/minimum-wage/state"
    ],
    "MO": [
      15,
      "Small retail/service businesses grossing <$500K/yr exempt",
      "Jan 2026",
      "https://labor.mo.gov/DLS/MinimumWage"
    ],
    "MT": [
      10.55,
      "Indexed to CPI; no tip credit, training wage, or meal credit allowed",
      "Jan 2026",
      "https://erd.dli.mt.gov/labor-standards/wage-and-hour-payment-act/state-minimum-wage"
    ],
    "NE": [
      15,
      "CPI-indexed annually starting 2027 (published by Oct 15)",
      "Jan 2026",
      "https://dol.nebraska.gov/laborstandards"
    ],
    "NV": [
      12,
      "Flat $12 for all employers since Jul 2024 (health benefit differential eliminated)",
      "Jul 2024",
      "https://labor.nv.gov/Laborer/Minimum_Wage/Minimum_Wage_Information/"
    ],
    "NH": [
      7.25,
      "No state law above federal",
      "Federal",
      "https://www.dol.nh.gov/inspections/wage-and-hour/minimum-wage"
    ],
    "NJ": [
      15.92,
      "Indexed to CPI for large employers; seasonal/small employer $15.23; agricultural $14.20",
      "Jan 2026",
      "https://www.nj.gov/labor/lwdhome/press/2025/20251001_Minimum_Wage.shtml"
    ],
    "NM": [
      12,
      "State rate ($12) prevails in Albuquerque (city floor $11.85); city rate rises to $13 in 2027",
      "Jan 2023",
      "https://www.dws.state.nm.us/Businesses/Employer-Resources/Minimum-Wage-Frequently-Asked-Questions"
    ],
    "NY": [
      17.0,
      "Rest of NY State: $16.00; CPI-indexed from 2027",
      "Jan 2026",
      "https://dol.ny.gov/minimum-wage"
    ],
    "NC": [
      7.25,
      "No state law above federal",
      "Federal",
      "https://www.labor.nc.gov/workplace-rights/employee-rights-regarding-time-worked-and-wages-earned/minimum-wage-nc"
    ],
    "ND": [
      7.25,
      "No state law above federal",
      "Federal",
      "https://www.nd.gov/labor/wage-and-hour-faq"
    ],
    "OH": [
      11.0,
      "Small employers (<$405K gross): $7.25; tipped $5.50",
      "Jan 2026",
      "https://dam.assets.ohio.gov/image/upload/com.ohio.gov/DICO/WageAndHour/2026_Minumum_Wage_Poster.pdf"
    ],
    "OK": [
      7.25,
      "No state law above federal",
      "Federal",
      "https://www.dol.gov/agencies/whd/minimum-wage/state"
    ],
    "OR": [
      15.55,
      "Portland metro: $16.80; non-urban: $14.55",
      "Jul 2026",
      "https://www.oregon.gov/boli/workers/pages/minimum-wage.aspx"
    ],
    "PA": [
      7.25,
      "No change; pending legislation",
      "Federal",
      "https://www.pa.gov/en/agencies/dli/resources/compliance-laws-and-regulations/labor-management-relations/pennsylvania-s-minimum-wage-act.html"
    ],
    "RI": [
      16,
      "Scheduled to increase to $17.00 Jan 2027",
      "Jan 2026",
      "https://dlt.ri.gov/regulation-and-safety/labor-standards/minimum-wage"
    ],
    "SC": [
      7.25,
      "No state law \u2014 federal applies",
      "Federal",
      null
    ],
    "SD": [
      11.85,
      "Indexed to CPI",
      "Jan 2026",
      "https://dlr.sd.gov/employment_laws/minimum_wage.aspx"
    ],
    "TN": [
      7.25,
      "No state law \u2014 federal applies",
      "Federal",
      null
    ],
    "TX": [
      7.25,
      "No state law above federal",
      "Federal",
      "https://www.twc.texas.gov/programs/wage-and-hour/texas-minimum-wage-law"
    ],
    "UT": [
      7.25,
      "No state law above federal",
      "Federal",
      "https://laborcommission.utah.gov/divisions/AntidiscriminationAndLabor/minimum_wage.html"
    ],
    "VT": [
      14.42,
      "Indexed to CPI; tipped $7.21",
      "Jan 2026",
      "https://labor.vermont.gov/wage-and-hour/minimum-wage"
    ],
    "VA": [
      12.77,
      "New schedule per 2026 law (HB1): $13.75 (2027), $15.00 (2028), then CPI-indexed",
      "Jan 2026",
      "https://doli.virginia.gov/2025/07/29/virginia-minimum-wage-rate-increasing-effective-january-1-2026/"
    ],
    "WA": [
      17.13,
      "Seattle: $21.30; Tukwila: $21.65; SeaTac (hospitality/transport): $20.74",
      "Jan 2026",
      "https://lni.wa.gov/workers-rights/wages/minimum-wage/"
    ],
    "WV": [
      8.75,
      "",
      "",
      "https://labor.wv.gov/wage-hour/jobs-act/minimum-wage"
    ],
    "WI": [
      7.25,
      "No state law above federal",
      "Federal",
      "https://dwd.wisconsin.gov/er/laborstandards/minimumwage.htm"
    ],
    "WY": [
      5.15,
      "State below federal \u2014 FLSA $7.25 applies",
      "",
      "https://dws.wyo.gov/dws-division/labor-standards/workers-and-job-seekers/your-rights-as-a-worker/"
    ],
    "DC": [
      18.4,
      "Highest in US; CPI-indexed annually; tipped base $10.30",
      "Jul 2026",
      "https://does.dc.gov/service/office-wage-hour-compliance-0"
    ]
  },
  "unemployment": {
    "AL": [
      3.0
    ],
    "AK": [
      4.6
    ],
    "AZ": [
      4.8
    ],
    "AR": [
      4.2
    ],